{
  "version": 1,
  "name": "ERL Research Skills",
  "description": "An open-source research operating system for Robotics & AI, developed and maintained by ERL Lab.",
  "homepage": "https://github.com/UCL-ERL/skills",
  "license": "MIT",
  "compatibility": [
    "codex",
    "claude-code-manual",
    "agent-skills-style"
  ],
  "maintainers": [
    "ERL Lab"
  ],
  "contributors": [
    "ylhaichen"
  ],
  "skills": [
    {
      "id": "rai-research-flow",
      "name": "RAI Research Flow",
      "description": "Routes Robotics & AI research work across search, reading, evidence mapping, ideation, paper writing, figure planning, and audits. Use when the user asks to enter a field, build a literature base, brainstorm a project, write a survey or paper, or coordinate multiple research skills.",
      "path": "skills/flows/rai-research-flow",
      "type": "flow",
      "domain": "orchestration",
      "maturity": "draft",
      "depends_on": [
        "knowledge-base-onboarding",
        "paper-search-protocol",
        "paper-reading-card",
        "evidence-matrix-builder",
        "research-plan-grill",
        "research-idea-rubric",
        "venue-paper-outline",
        "citation-integrity-auditor",
        "manuscript-structure-auditor",
        "scientific-writing-editor",
        "related-work-positioning",
        "abstract-introduction-builder",
        "paper-draft-builder",
        "survey-synthesis-builder",
        "benchmark-audit",
        "experiment-provenance-auditor",
        "experiment-dossier-builder",
        "paper-code-consistency-auditor",
        "limitations-failure-case-auditor",
        "scientific-figure-director",
        "slide-talk-builder",
        "paper-red-team-review"
      ],
      "tags": [
        "robotics",
        "ai",
        "research",
        "workflow"
      ],
      "source_inspiration": [
        "anthropics/skills",
        "mattpocock/skills",
        "obra/superpowers",
        "addyosmani/agent-skills"
      ]
    },
    {
      "id": "rai-paper-flow",
      "name": "RAI Paper Flow",
      "description": "Routes Robotics & AI conference paper writing for ICRA, RSS, CoRL, ICML, ICLR, and NeurIPS style submissions. Use when the user asks to outline, draft, revise, audit, rebut, package, or prepare a research paper for Robotics or AI venues.",
      "path": "skills/flows/rai-paper-flow",
      "type": "flow",
      "domain": "writing",
      "maturity": "draft",
      "depends_on": [
        "research-plan-grill",
        "research-idea-rubric",
        "venue-paper-outline",
        "citation-integrity-auditor",
        "manuscript-structure-auditor",
        "scientific-writing-editor",
        "related-work-positioning",
        "abstract-introduction-builder",
        "paper-draft-builder",
        "survey-synthesis-builder",
        "benchmark-audit",
        "experiment-provenance-auditor",
        "experiment-dossier-builder",
        "paper-code-consistency-auditor",
        "limitations-failure-case-auditor",
        "scientific-figure-director",
        "slide-talk-builder",
        "paper-red-team-review",
        "reviewer-response-builder",
        "latex-submission-checker"
      ],
      "tags": [
        "paper-writing",
        "robotics",
        "machine-learning",
        "conference"
      ],
      "source_inspiration": [
        "mattpocock/skills",
        "obra/superpowers"
      ]
    },
    {
      "id": "rai-coding-flow",
      "name": "RAI Coding Flow",
      "description": "Routes Robotics & AI coding work through design, prototyping, debugging, testing, review, and reproducibility checks. Use when the user asks to build, debug, test, review, or restructure Python, C++, ROS, simulation, ML, or experiment code.",
      "path": "skills/flows/rai-coding-flow",
      "type": "flow",
      "domain": "engineering",
      "maturity": "draft",
      "depends_on": [
        "research-plan-grill",
        "robotics-ai-coding-flow",
        "experiment-provenance-auditor",
        "experiment-dossier-builder",
        "paper-code-consistency-auditor"
      ],
      "tags": [
        "robotics",
        "ai",
        "coding",
        "testing"
      ],
      "source_inspiration": [
        "mattpocock/skills",
        "addyosmani/agent-skills",
        "obra/superpowers"
      ]
    },
    {
      "id": "knowledge-base-onboarding",
      "name": "Knowledge Base Onboarding",
      "description": "Onboards a new Robotics or AI research area, project folder, or lab knowledge base into a structured source inventory, concept map, artifact map, and next-action plan. Use when the user starts a new area, inherits notes/code/papers, or needs a reusable research memory structure.",
      "path": "skills/research/knowledge-base-onboarding",
      "type": "atomic",
      "domain": "research",
      "maturity": "draft",
      "depends_on": [],
      "tags": [
        "knowledge-base",
        "onboarding",
        "research",
        "provenance"
      ],
      "source_inspiration": [
        "FAIR principles",
        "The Turing Way",
        "ACM Artifact Review and Badging"
      ]
    },
    {
      "id": "paper-search-protocol",
      "name": "Paper Search Protocol",
      "description": "Builds reproducible Robotics & AI search logs across papers, projects, datasets, benchmarks, and code. Use when the user asks for literature search, project search, survey source collection, related work discovery, or field onboarding.",
      "path": "skills/research/paper-search-protocol",
      "type": "atomic",
      "domain": "research",
      "maturity": "draft",
      "depends_on": [],
      "tags": [
        "literature-search",
        "survey",
        "robotics",
        "ai"
      ],
      "source_inspiration": [
        "nature-academic-search",
        "mattpocock/skills"
      ]
    },
    {
      "id": "paper-reading-card",
      "name": "Paper Reading Card",
      "description": "Turns one Robotics & AI paper into a structured, source-grounded reading card. Use when the user asks to read, summarize, compare, or extract claims, methods, experiments, limitations, and reusable ideas from a paper.",
      "path": "skills/research/paper-reading-card",
      "type": "atomic",
      "domain": "research",
      "maturity": "draft",
      "depends_on": [],
      "tags": [
        "paper-reading",
        "summary",
        "robotics",
        "ai"
      ],
      "source_inspiration": [
        "nature-reader",
        "mattpocock/skills"
      ]
    },
    {
      "id": "evidence-matrix-builder",
      "name": "Evidence Matrix Builder",
      "description": "Builds comparison matrices, taxonomies, and gap maps from paper cards, projects, datasets, or benchmark notes. Use when the user asks to synthesize a literature base, write a survey, compare methods, or find research gaps.",
      "path": "skills/research/evidence-matrix-builder",
      "type": "atomic",
      "domain": "research",
      "maturity": "draft",
      "depends_on": [
        "paper-reading-card"
      ],
      "tags": [
        "evidence",
        "survey",
        "taxonomy",
        "gap-analysis"
      ],
      "source_inspiration": [
        "mattpocock/skills",
        "ml-paper-writing"
      ]
    },
    {
      "id": "research-idea-rubric",
      "name": "Research Idea Rubric",
      "description": "Scores and refines Robotics & AI project ideas for novelty, feasibility, baselines, evaluation, risk, and publishability. Use when brainstorming, ranking, stress-testing, or improving research ideas with or without the user.",
      "path": "skills/ideation/research-idea-rubric",
      "type": "reference",
      "domain": "ideation",
      "maturity": "draft",
      "depends_on": [],
      "tags": [
        "brainstorming",
        "research-ideas",
        "robotics",
        "ai"
      ],
      "source_inspiration": [
        "brainstorming-research-ideas",
        "creative-thinking-for-research",
        "mattpocock/skills"
      ]
    },
    {
      "id": "research-plan-grill",
      "name": "Research Plan Grill",
      "description": "Interrogates a Robotics or AI research, paper, experiment, survey, or engineering plan one decision at a time until its objective, evidence, scope, evaluation, risks, and next artifact are explicit. Use when the user asks to be grilled, wants a plan stress-tested through questions, or has an ambiguous design that should be resolved before implementation or writing.",
      "path": "skills/ideation/research-plan-grill",
      "type": "atomic",
      "domain": "ideation",
      "maturity": "draft",
      "depends_on": [],
      "tags": [
        "interview",
        "planning",
        "decision-making",
        "research"
      ],
      "source_inspiration": [
        "grill-me",
        "mattpocock/skills"
      ]
    },
    {
      "id": "venue-paper-outline",
      "name": "Venue Paper Outline",
      "description": "Plans Robotics & AI conference paper structure for ICRA, RSS, CoRL, ICML, ICLR, and NeurIPS style submissions. Use when the user asks for an outline, paper skeleton, section plan, contribution framing, or venue-aware writing strategy.",
      "path": "skills/writing/venue-paper-outline",
      "type": "reference",
      "domain": "writing",
      "maturity": "draft",
      "depends_on": [],
      "tags": [
        "paper-writing",
        "conference",
        "icra",
        "neurips"
      ],
      "source_inspiration": [
        "ml-paper-writing",
        "systems-paper-writing",
        "nature-writing"
      ]
    },
    {
      "id": "related-work-positioning",
      "name": "Related Work Positioning",
      "description": "Positions a paper against prior work by building source-grounded clusters, contribution boundaries, novelty claims, and comparison language. Use when writing related work, introduction positioning, survey paragraphs, or responses about novelty and differentiation.",